{"$schema":"https://json-schema.org/draft/2020-12/schema","$id":"https://mtg-lab.dev/schemas/v1/parsed-record-artifact.schema.json","title":"Parsed Record Artifact","type":"object","additionalProperties":false,"required":["schema_version","id","product_id","source_id","acquisition_target_id","raw_evidence_hash","parser_id","parser_version","parsed_at","input_content_type","record_count","parse_status","records","errors","warnings","artifact_version"],"properties":{"schema_version":{"const":"v1"},"id":{"$ref":"#/$defs/id"},"product_id":{"$ref":"#/$defs/id"},"source_id":{"$ref":"#/$defs/id"},"acquisition_target_id":{"$ref":"#/$defs/id"},"raw_evidence_hash":{"pattern":"^[a-f0-9]{64}$","type":"string"},"parser_id":{"$ref":"#/$defs/id"},"parser_version":{"type":"string","minLength":1},"parsed_at":{"type":"string","format":"date-time"},"input_content_type":{"type":"string","minLength":1},"record_count":{"type":"integer","minimum":0},"parse_status":{"enum":["succeeded","partial","failed"]},"records":{"type":"array","items":{"$ref":"#/$defs/record"}},"errors":{"type":"array","items":{"type":"string"}},"warnings":{"type":"array","items":{"type":"string"}},"artifact_version":{"type":"string","minLength":1}},"$defs":{"id":{"type":"string","pattern":"^[a-z0-9][a-z0-9._-]*$"},"record":{"type":"object","additionalProperties":false,"required":["id","record_type","raw_fields","errors","warnings"],"properties":{"id":{"$ref":"#/$defs/id"},"record_type":{"type":"string","minLength":1},"source_location":{"type":["string","integer","null"]},"raw_fields":{"type":"object"},"source_excerpt":{"type":["object","null"]},"errors":{"type":"array","items":{"type":"string"}},"warnings":{"type":"array","items":{"type":"string"}}}}}}